{
  "registry_version": "2.0",
  "name": "kicad-cli",
  "product_version": "2.0.0",
  "description": "Incremental real saved-board writes, project sync and four saved-document observations.",
  "risk_tier": "T1",
  "builtins": {
    "maturity": "experimental",
    "evidence_refs": []
  },
  "record": {
    "store": "SQLite in KICAD_CLI_STATE_DIR, default ~/.kicad-cli",
    "retain_days": 30,
    "survives_cli_exit": true,
    "survives_reconnect": true,
    "survives_instance_restart": true,
    "limitations": [
      "Machine-local records; a killed synchronous writer becomes unknown after its 30-second lease.",
      "Listed writes and operation management need valid on-disk local state; four observations do not open the operation store."
    ]
  },
  "schemas": {
    "move_receipt": {
      "shape": "object",
      "fields": [
        "receipt",
        "preview",
        "confirm_token",
        "expires_at"
      ],
      "untrusted_fields": [
        "receipt.changed_items",
        "preview.changes"
      ],
      "json_schema": {
        "$ref": "urn:tool-driver-cli-spec:receipt:2.0"
      }
    },
    "zone_receipt": {
      "shape": "object",
      "fields": [
        "receipt",
        "preview",
        "confirm_token",
        "expires_at"
      ],
      "untrusted_fields": [
        "receipt.changed_items",
        "receipt.extensions.readback",
        "receipt.extensions.finding_comparison",
        "preview.changes"
      ],
      "json_schema": {
        "$ref": "urn:tool-driver-cli-spec:receipt:2.0"
      }
    },
    "sync_receipt": {
      "shape": "object",
      "fields": [
        "receipt",
        "preview",
        "confirm_token",
        "expires_at"
      ],
      "untrusted_fields": [
        "receipt.changed_items",
        "receipt.extensions",
        "preview.changes",
        "preview.extensions"
      ],
      "json_schema": {
        "$ref": "urn:tool-driver-cli-spec:receipt:2.0"
      }
    },
    "board_check_observation": {
      "shape": "object",
      "fields": [
        "board",
        "counts",
        "custom_rules",
        "engine",
        "excluded_count",
        "ignored",
        "limited_checks_passed",
        "not_checked",
        "note",
        "observation",
        "ok_to_fabricate",
        "partial",
        "truncated",
        "unconnected",
        "unconnected_count",
        "unconnected_total",
        "violations",
        "violations_matching_severity",
        "violations_shown",
        "violations_total"
      ],
      "untrusted_fields": [
        "board",
        "counts",
        "custom_rules",
        "engine",
        "excluded_count",
        "ignored",
        "limited_checks_passed",
        "not_checked",
        "note",
        "ok_to_fabricate",
        "partial",
        "truncated",
        "unconnected",
        "unconnected_count",
        "unconnected_total",
        "violations",
        "violations_matching_severity",
        "violations_shown",
        "violations_total",
        "observation.inputs"
      ],
      "json_schema": {
        "type": "object",
        "required": [
          "observation"
        ],
        "properties": {
          "observation": {
            "type": "object",
            "required": [
              "source",
              "inputs",
              "snapshot",
              "coverage",
              "state",
              "input_drift_checked",
              "live_editor_observed"
            ],
            "properties": {
              "source": {
                "type": "object",
                "required": [
                  "version",
                  "code_sha256",
                  "origin",
                  "completed",
                  "completed_at",
                  "official_native"
                ],
                "properties": {
                  "completed": {
                    "const": true
                  },
                  "official_native": {
                    "const": false
                  }
                }
              },
              "inputs": {
                "type": "array",
                "minItems": 1
              },
              "snapshot": {
                "type": "object",
                "required": [
                  "revision",
                  "basis",
                  "observed_at"
                ]
              },
              "coverage": {
                "type": "object",
                "required": [
                  "checked",
                  "not_checked",
                  "native"
                ]
              },
              "state": {
                "const": "saved_files"
              },
              "input_drift_checked": {
                "const": true
              },
              "live_editor_observed": {
                "const": false
              }
            }
          }
        }
      }
    },
    "sch_check_observation": {
      "shape": "object",
      "fields": [
        "as_configured",
        "configured_exclusions",
        "cross_sheet_connectivity",
        "detail_samples",
        "exclusions_applied",
        "findings",
        "footprint_filters",
        "not_checked",
        "observation",
        "schematic",
        "sheets",
        "silenced_rules",
        "status",
        "with_rules_enabled"
      ],
      "untrusted_fields": [
        "as_configured",
        "configured_exclusions",
        "cross_sheet_connectivity",
        "detail_samples",
        "exclusions_applied",
        "findings",
        "footprint_filters",
        "not_checked",
        "schematic",
        "sheets",
        "silenced_rules",
        "status",
        "with_rules_enabled",
        "observation.inputs"
      ],
      "json_schema": {
        "type": "object",
        "required": [
          "observation"
        ],
        "properties": {
          "observation": {
            "type": "object",
            "required": [
              "source",
              "inputs",
              "snapshot",
              "coverage",
              "state",
              "input_drift_checked",
              "live_editor_observed"
            ],
            "properties": {
              "source": {
                "type": "object",
                "required": [
                  "version",
                  "code_sha256",
                  "origin",
                  "completed",
                  "completed_at",
                  "official_native"
                ],
                "properties": {
                  "completed": {
                    "const": true
                  },
                  "official_native": {
                    "const": false
                  }
                }
              },
              "inputs": {
                "type": "array",
                "minItems": 1
              },
              "snapshot": {
                "type": "object",
                "required": [
                  "revision",
                  "basis",
                  "observed_at"
                ]
              },
              "coverage": {
                "type": "object",
                "required": [
                  "checked",
                  "not_checked",
                  "native"
                ]
              },
              "state": {
                "const": "saved_files"
              },
              "input_drift_checked": {
                "const": true
              },
              "live_editor_observed": {
                "const": false
              }
            }
          }
        }
      }
    },
    "project_links_inspect_observation": {
      "shape": "object",
      "fields": [
        "at_risk",
        "board",
        "board_only",
        "dangling",
        "details",
        "findings",
        "footprints",
        "footprints_from_schematic",
        "linked",
        "mismatched",
        "multi_unit_parts",
        "not_checked",
        "observation",
        "observed_footprints",
        "observed_symbol_instances",
        "orphan_symbols",
        "root_schematic",
        "schematic_files",
        "status",
        "symbols",
        "unannotated",
        "unlinked",
        "virtual_symbols"
      ],
      "untrusted_fields": [
        "at_risk",
        "board",
        "board_only",
        "dangling",
        "details",
        "findings",
        "footprints",
        "footprints_from_schematic",
        "linked",
        "mismatched",
        "multi_unit_parts",
        "not_checked",
        "observed_footprints",
        "observed_symbol_instances",
        "orphan_symbols",
        "root_schematic",
        "schematic_files",
        "status",
        "symbols",
        "unannotated",
        "unlinked",
        "virtual_symbols",
        "observation.inputs"
      ],
      "json_schema": {
        "type": "object",
        "required": [
          "observation"
        ],
        "properties": {
          "observation": {
            "type": "object",
            "required": [
              "source",
              "inputs",
              "snapshot",
              "coverage",
              "state",
              "input_drift_checked",
              "live_editor_observed"
            ],
            "properties": {
              "source": {
                "type": "object",
                "required": [
                  "version",
                  "code_sha256",
                  "origin",
                  "completed",
                  "completed_at",
                  "official_native"
                ],
                "properties": {
                  "completed": {
                    "const": true
                  },
                  "official_native": {
                    "const": false
                  }
                }
              },
              "inputs": {
                "type": "array",
                "minItems": 1
              },
              "snapshot": {
                "type": "object",